{
	"$schema": "http://json-schema.org/draft-07/schema#",
	"$id": "https://c4ish.dev/schema/v0/model.json",
	"title": "c4ish model (schema v0)",
	"type": "object",
	"required": [
		"schemaVersion",
		"title",
		"views",
		"elements"
	],
	"additionalProperties": false,
	"properties": {
		"$schema": {
			"type": "string"
		},
		"schemaVersion": {
			"const": 0
		},
		"id": {
			"type": "string"
		},
		"title": {
			"type": "string"
		},
		"summary": {
			"type": "string"
		},
		"profile": {
			"type": "string"
		},
		"provenance": {
			"type": "object"
		},
		"views": {
			"type": "array",
			"minItems": 1,
			"items": {
				"type": "object",
				"required": [
					"id",
					"kind",
					"title"
				],
				"additionalProperties": false,
				"properties": {
					"id": {
						"type": "string",
						"pattern": "^[A-Za-z_][A-Za-z0-9_.:/-]*$"
					},
					"kind": {
						"type": "string"
					},
					"title": {
						"type": "string"
					},
					"subtitle": {
						"type": "string"
					},
					"focus": {
						"type": "array",
						"items": {
							"type": "string"
						}
					},
					"include": {
						"type": "array",
						"items": {
							"type": "string",
							"pattern": "^[A-Za-z_][A-Za-z0-9_.:/-]*$"
						}
					},
					"exclude": {
						"type": "array",
						"items": {
							"type": "string",
							"pattern": "^[A-Za-z_][A-Za-z0-9_.:/-]*$"
						}
					},
					"omitRelationships": {
						"type": "array",
						"items": {
							"type": "string",
							"pattern": "^[A-Za-z_][A-Za-z0-9_.:/-]*$"
						}
					},
					"direction": {
						"enum": [
							"right",
							"down",
							"left",
							"up",
							"auto"
						]
					},
					"fields": {
						"enum": [
							"all",
							"changed",
							"none"
						]
					}
				}
			}
		},
		"elements": {
			"type": "array",
			"items": {
				"type": "object",
				"required": [
					"id",
					"kind",
					"title"
				],
				"additionalProperties": false,
				"properties": {
					"id": {
						"type": "string",
						"pattern": "^[A-Za-z_][A-Za-z0-9_.:/-]*$"
					},
					"kind": {
						"type": "string"
					},
					"parent": {
						"type": "string",
						"pattern": "^[A-Za-z_][A-Za-z0-9_.:/-]*$"
					},
					"title": {
						"type": "string"
					},
					"subtitle": {
						"type": "string"
					},
					"details": {
						"anyOf": [
							{
								"type": "string"
							},
							{
								"type": "array",
								"items": {
									"type": "string"
								}
							}
						]
					},
					"pattern": {
						"anyOf": [
							{
								"type": "string"
							},
							{
								"type": "null"
							}
						]
					},
					"patternFit": {
						"enum": [
							"full",
							"partial"
						]
					},
					"patterns": {
						"type": "array",
						"items": {
							"type": "string"
						}
					},
					"change": {
						"type": "string"
					},
					"lifecycle": {
						"type": "string"
					},
					"area": {
						"type": "string"
					},
					"libraries": {
						"type": "array",
						"items": {
							"type": "string",
							"pattern": "^[A-Za-z_][A-Za-z0-9_.:/-]*$"
						}
					},
					"version": {
						"type": "string"
					},
					"fields": {
						"type": "array",
						"items": {
							"type": "object",
							"required": [
								"id"
							],
							"additionalProperties": false,
							"properties": {
								"id": {
									"type": "string"
								},
								"title": {
									"type": "string"
								},
								"type": {
									"type": "string"
								},
								"change": {
									"type": "string"
								},
								"note": {
									"type": "string"
								}
							}
						}
					},
					"indexes": {
						"type": "array",
						"items": {
							"type": "object",
							"required": [
								"id",
								"fields"
							],
							"additionalProperties": false,
							"properties": {
								"id": {
									"type": "string"
								},
								"fields": {
									"type": "array",
									"items": {
										"type": "string"
									}
								},
								"change": {
									"type": "string"
								}
							}
						}
					},
					"ties": {
						"type": "array",
						"items": {
							"type": "object",
							"required": [
								"fields"
							],
							"additionalProperties": false,
							"properties": {
								"id": {
									"type": "string"
								},
								"fields": {
									"type": "array",
									"items": {
										"type": "string"
									},
									"minItems": 2,
									"maxItems": 2
								},
								"label": {
									"type": "string"
								},
								"enforcement": {
									"type": "string"
								},
								"change": {
									"type": "string"
								},
								"divergence": {
									"anyOf": [
										{
											"type": "string"
										},
										{
											"type": "object",
											"required": [
												"id"
											],
											"additionalProperties": false,
											"properties": {
												"id": {
													"type": "string"
												},
												"text": {
													"type": "string"
												}
											}
										}
									]
								}
							}
						}
					},
					"parts": {
						"type": "array",
						"items": {
							"type": "object",
							"required": [
								"title"
							],
							"additionalProperties": false,
							"properties": {
								"title": {
									"type": "string"
								},
								"pattern": {
									"anyOf": [
										{
											"type": "string"
										},
										{
											"type": "null"
										}
									]
								},
								"change": {
									"type": "string"
								}
							}
						}
					},
					"divergence": {
						"anyOf": [
							{
								"type": "string"
							},
							{
								"type": "object",
								"required": [
									"id"
								],
								"additionalProperties": false,
								"properties": {
									"id": {
										"type": "string"
									},
									"text": {
										"type": "string"
									}
								}
							}
						]
					},
					"implementedBy": {
						"type": "array",
						"items": {
							"type": "string",
							"pattern": "^[A-Za-z_][A-Za-z0-9_.:/-]*$"
						}
					},
					"mappingLabel": {
						"type": "string"
					},
					"sources": {
						"type": "array",
						"items": {
							"type": "string"
						}
					},
					"views": {
						"type": "array",
						"items": {
							"type": "string",
							"pattern": "^[A-Za-z_][A-Za-z0-9_.:/-]*$"
						}
					}
				}
			}
		},
		"relationships": {
			"type": "array",
			"items": {
				"type": "object",
				"required": [
					"id",
					"from",
					"to",
					"kind"
				],
				"additionalProperties": false,
				"properties": {
					"id": {
						"type": "string",
						"pattern": "^[A-Za-z_][A-Za-z0-9_.:/-]*$"
					},
					"from": {
						"type": "string",
						"pattern": "^[A-Za-z_][A-Za-z0-9_.:/-]*$"
					},
					"to": {
						"type": "string",
						"pattern": "^[A-Za-z_][A-Za-z0-9_.:/-]*$"
					},
					"kind": {
						"type": "string"
					},
					"enforcement": {
						"type": "string"
					},
					"change": {
						"type": "string"
					},
					"label": {
						"type": "string"
					},
					"details": {
						"anyOf": [
							{
								"type": "string"
							},
							{
								"type": "array",
								"items": {
									"type": "string"
								}
							}
						]
					},
					"contract": {
						"type": "string",
						"pattern": "^[A-Za-z_][A-Za-z0-9_.:/-]*$"
					},
					"divergence": {
						"anyOf": [
							{
								"type": "string"
							},
							{
								"type": "object",
								"required": [
									"id"
								],
								"additionalProperties": false,
								"properties": {
									"id": {
										"type": "string"
									},
									"text": {
										"type": "string"
									}
								}
							}
						]
					},
					"delta": {
						"enum": [
							"added",
							"removed"
						]
					},
					"fromField": {
						"type": "string"
					},
					"toField": {
						"type": "string"
					},
					"views": {
						"type": "array",
						"items": {
							"type": "string",
							"pattern": "^[A-Za-z_][A-Za-z0-9_.:/-]*$"
						}
					}
				}
			}
		},
		"contracts": {
			"type": "array",
			"items": {
				"type": "object",
				"required": [
					"id",
					"clauses"
				],
				"additionalProperties": false,
				"properties": {
					"id": {
						"type": "string",
						"pattern": "^[A-Za-z_][A-Za-z0-9_.:/-]*$"
					},
					"title": {
						"type": "string"
					},
					"change": {
						"type": "string"
					},
					"clauses": {
						"type": "object",
						"additionalProperties": {
							"type": "string"
						}
					}
				}
			}
		},
		"notes": {
			"type": "array",
			"items": {
				"type": "object",
				"required": [
					"text"
				],
				"additionalProperties": false,
				"properties": {
					"id": {
						"type": "string",
						"pattern": "^[A-Za-z_][A-Za-z0-9_.:/-]*$"
					},
					"on": {
						"type": "string",
						"pattern": "^[A-Za-z_][A-Za-z0-9_.:/-]*$"
					},
					"kind": {
						"enum": [
							"focus",
							"risk",
							"note",
							"question"
						]
					},
					"title": {
						"type": "string"
					},
					"text": {
						"type": "string"
					},
					"views": {
						"type": "array",
						"items": {
							"type": "string",
							"pattern": "^[A-Za-z_][A-Za-z0-9_.:/-]*$"
						}
					}
				}
			}
		},
		"absences": {
			"type": "array",
			"items": {
				"type": "object",
				"required": [
					"id",
					"text"
				],
				"additionalProperties": false,
				"properties": {
					"id": {
						"type": "string",
						"pattern": "^[A-Za-z_][A-Za-z0-9_.:/-]*$"
					},
					"parent": {
						"type": "string",
						"pattern": "^[A-Za-z_][A-Za-z0-9_.:/-]*$"
					},
					"text": {
						"type": "string"
					},
					"views": {
						"type": "array",
						"items": {
							"type": "string",
							"pattern": "^[A-Za-z_][A-Za-z0-9_.:/-]*$"
						}
					}
				}
			}
		},
		"proposedPatterns": {
			"type": "array",
			"items": {
				"type": "object",
				"required": [
					"id",
					"label",
					"family"
				],
				"additionalProperties": false,
				"properties": {
					"id": {
						"type": "string",
						"pattern": "^[A-Za-z_][A-Za-z0-9_.:/-]*$"
					},
					"label": {
						"type": "string"
					},
					"family": {
						"type": "string"
					},
					"status": {
						"enum": [
							"catalogued",
							"proposed"
						]
					},
					"icon": {
						"type": "string"
					},
					"colour": {
						"type": "string",
						"pattern": "^#[0-9a-fA-F]{3,8}$"
					},
					"catalog": {
						"type": "string"
					},
					"description": {
						"type": "string"
					}
				}
			}
		}
	}
}
