{
	"$schema": "../../schema/model.schema.json",
	"schemaVersion": 0,
	"id": "versioned-wiring",
	"title": "Event contracts: version-pinned wiring",
	"summary": "Services pin the exact event-contract version they provide or require; the wiring page shows and edits those pins.",
	"profile": "../profile.c4ish.json",
	"provenance": { "baseline": "example", "note": "Invented example mirroring a real versioned-entity wiring change." },
	"views": [
		{
			"id": "product",
			"kind": "product",
			"title": "Event contracts — services wire to exact versions",
			"subtitle": "A service version provides or requires one exact contract version. Drafts move; released versions are frozen.",
			"focus": [
				"Wiring is between versions, not between names: Billing v2 (draft) moves its pin from v1.0 to v1.1.",
				"Released versions are frozen: Ledger v1 keeps requiring v1.0 until a new Ledger version is drafted."
			],
			"include": ["contract", "billing", "ledger", "page"]
		},
		{
			"id": "engineering",
			"kind": "engineering",
			"title": "Event contracts — wiring writes and the version page",
			"subtitle": "One guarded mutation owns all pin writes; the page composes reused version frames with a proposed picker.",
			"focus": [
				"Every pin write goes through the wiring guard; nothing in the schema stops two pins to the same contract.",
				"Group re-wiring is proposed as a new pattern; approve or redirect it.",
				"Callers only partly follow the confirmed-tool pattern."
			],
			"include": ["web", "api", "db", "tools"]
		}
	],
	"elements": [
		{ "id": "contract", "kind": "product", "title": "InvoiceIssued", "subtitle": "Event contract", "change": "reused", "views": ["product"] },
		{ "id": "c10", "kind": "version", "parent": "contract", "title": "v1.0", "subtitle": "Amount + currency", "lifecycle": "released", "change": "reused", "implementedBy": ["contractVersions"] },
		{ "id": "c11", "kind": "version", "parent": "contract", "title": "v1.1", "subtitle": "Adds tax lines", "lifecycle": "draft", "change": "new", "implementedBy": ["contractVersions"] },
		{ "id": "billing", "kind": "configuration", "title": "Billing service", "subtitle": "Producer", "change": "reused", "views": ["product"] },
		{ "id": "billing2", "kind": "version", "area": "system", "parent": "billing", "title": "Billing v2", "subtitle": "Being prepared", "lifecycle": "draft", "change": "modified", "implementedBy": ["pins"], "mappingLabel": "serviceContractPins" },
		{ "id": "ledger", "kind": "configuration", "title": "Ledger service", "subtitle": "Consumer", "change": "reused", "views": ["product"] },
		{ "id": "ledger1", "kind": "version", "area": "system", "parent": "ledger", "title": "Ledger v1", "subtitle": "In production", "lifecycle": "released", "change": "reused" },
		{ "id": "page", "kind": "page", "title": "Contract page", "subtitle": "One page per contract version", "change": "modified", "views": ["product"] },
		{ "id": "tabOverview", "kind": "page", "parent": "page", "title": "Overview", "change": "reused" },
		{ "id": "tabWiring", "kind": "page", "parent": "page", "title": "Wiring", "subtitle": "Who provides / requires this version", "change": "new", "implementedBy": ["picker", "wiringRead"] },
		{ "id": "tabCompare", "kind": "page", "parent": "page", "title": "Compare", "subtitle": "Diff against the version it was created from", "change": "reused" },

		{ "id": "web", "kind": "container", "title": "Web app", "subtitle": "Contract pages", "change": "modified", "views": ["engineering"] },
		{ "id": "route", "kind": "component", "parent": "web", "title": "Version route", "subtitle": "/contracts/[id]/v/[version]", "pattern": "web/route-actions", "change": "modified" },
		{ "id": "frame", "kind": "component", "parent": "web", "title": "Version detail frame", "subtitle": "Header, lifecycle, tabs", "pattern": "web/detail-frame", "change": "reused" },
		{
			"id": "picker",
			"kind": "component",
			"parent": "web",
			"title": "Version picker",
			"subtitle": "Choose provider / consumer versions",
			"pattern": "web/version-picker",
			"change": "new",
			"details": "Lists only versions the viewer can wire; released targets are read-only."
		},
		{ "id": "api", "kind": "container", "title": "Backend", "subtitle": "Queries and one guarded write", "change": "modified", "views": ["engineering"] },
		{ "id": "wiringRead", "kind": "component", "parent": "api", "title": "wiring.forVersion", "subtitle": "Providers + consumers of one version", "pattern": "api/tenant-query", "change": "new" },
		{ "id": "diff", "kind": "component", "parent": "api", "title": "versions.diff", "subtitle": "Field-level diff", "pattern": "api/tenant-query", "change": "reused" },
		{
			"id": "guard",
			"kind": "component",
			"parent": "api",
			"title": "Wiring guard",
			"subtitle": "Draft-only, same tenant, one pin per contract",
			"pattern": "api/guarded-mutation",
			"change": "new",
			"details": ["Rejects writes to released service versions.", "Checks the target contract version is visible to the caller."]
		},
		{
			"id": "rewire",
			"kind": "component",
			"parent": "api",
			"title": "Group re-wire",
			"subtitle": "Move every pin of a draft in one transaction",
			"pattern": "api/group-rewire",
			"change": "new"
		},
		{ "id": "db", "kind": "container", "title": "Database", "subtitle": "One new table", "change": "modified", "views": ["engineering"] },
		{
			"id": "contractVersions",
			"kind": "data",
			"parent": "db",
			"title": "contractVersions",
			"pattern": "data/versioned-rows",
			"patterns": ["data/tenant-scoped"],
			"change": "reused",
			"fields": [
				{ "id": "contractId", "type": "Id<contracts>" },
				{ "id": "version", "type": "string" },
				{ "id": "status", "type": "draft | released" }
			]
		},
		{
			"id": "pins",
			"kind": "data",
			"parent": "db",
			"title": "serviceContractPins",
			"subtitle": "One row per (service version, contract)",
			"pattern": "data/typed-join",
			"patterns": ["data/tenant-scoped"],
			"change": "new",
			"fields": [
				{ "id": "serviceVersionId", "type": "Id<serviceVersions>", "change": "new" },
				{ "id": "contractVersionId", "type": "Id<contractVersions>", "change": "new" },
				{ "id": "role", "type": "provides | requires", "change": "new" }
			],
			"indexes": [
				{ "id": "by_service_version", "fields": ["serviceVersionId"], "change": "new" },
				{ "id": "by_contract_version", "fields": ["contractVersionId"], "change": "new" }
			]
		},
		{ "id": "serviceVersions", "kind": "data", "parent": "db", "title": "serviceVersions", "pattern": "data/versioned-rows", "change": "reused" },
		{ "id": "tools", "kind": "container", "title": "Operator tools", "subtitle": "Existing callers", "change": "modified", "views": ["engineering"] },
		{
			"id": "cli",
			"kind": "caller",
			"parent": "tools",
			"title": "Admin CLI",
			"subtitle": "Bulk import of pins",
			"pattern": "api/confirmed-tool",
			"patternFit": "partial",
			"change": "modified",
			"parts": [
				{ "title": "dry-run + confirm", "pattern": "api/confirmed-tool", "change": "reused" },
				{ "title": "raw CSV import", "pattern": null, "change": "modified" }
			]
		}
	],
	"relationships": [
		{ "id": "b2provides11", "from": "billing2", "to": "c11", "kind": "provides", "change": "new", "delta": "added", "label": "pin moves here" },
		{ "id": "b2provides10", "from": "billing2", "to": "c10", "kind": "provides", "change": "removed", "delta": "removed", "label": "old pin" },
		{ "id": "l1requires10", "from": "ledger1", "to": "c10", "kind": "requires", "change": "reused", "label": "frozen" },
		{ "id": "c11from10", "from": "c11", "to": "c10", "kind": "created-from", "change": "new" },
		{ "id": "tabShows", "from": "tabWiring", "to": "c11", "kind": "selects", "change": "new", "label": "shows pins of this version" },

		{ "id": "routeFrame", "from": "route", "to": "frame", "kind": "composes", "change": "reused" },
		{ "id": "framePicker", "from": "frame", "to": "picker", "kind": "composes", "change": "new" },
		{ "id": "routeRead", "from": "route", "to": "wiringRead", "kind": "calls", "change": "new", "label": "load providers + consumers" },
		{ "id": "routeDiff", "from": "route", "to": "diff", "kind": "calls", "change": "reused" },
		{ "id": "pickerWrite", "from": "picker", "to": "guard", "kind": "submits", "change": "new", "label": "set / clear pin", "contract": "setPin" },
		{ "id": "rewireGuard", "from": "rewire", "to": "guard", "kind": "authorizes", "change": "new", "label": "per-pin checks" },
		{ "id": "pickerRewire", "from": "picker", "to": "rewire", "kind": "submits", "change": "new", "label": "move all pins" },
		{ "id": "guardWrites", "from": "guard", "to": "pins", "kind": "writes", "enforcement": "our-code", "change": "new", "label": "only write path" },
		{ "id": "readPins", "from": "wiringRead", "to": "pins", "kind": "reads", "enforcement": "platform", "change": "new", "label": "by_contract_version" },
		{ "id": "pinContract", "from": "pins", "to": "contractVersions", "kind": "pins", "enforcement": "platform", "change": "new", "fromField": "contractVersionId", "label": "typed id" },
		{ "id": "pinService", "from": "pins", "to": "serviceVersions", "kind": "pins", "enforcement": "platform", "change": "new", "fromField": "serviceVersionId", "label": "typed id" },
		{ "id": "diffRead", "from": "diff", "to": "contractVersions", "kind": "reads", "enforcement": "platform", "change": "reused" },
		{ "id": "cliWrites", "from": "cli", "to": "pins", "kind": "writes", "enforcement": "nothing", "change": "modified", "label": "raw import bypasses guard" }
	],
	"contracts": [
		{
			"id": "setPin",
			"title": "wiring.setPin",
			"change": "new",
			"clauses": {
				"args": "serviceVersionId, contractId, role, contractVersionId | null",
				"access": "editor of the service; service version must be draft",
				"atomicity": "replaces the existing pin for (service version, contract, role) in one transaction"
			}
		}
	],
	"notes": [